ОЭЗ «Технополис Москва» в 2022 году сдала в аренду около восьми тысяч квадратных метров помещений;С начала этого года новые предприятия арендовали на площадке «Алабушево» особой экономической зоны (ОЭЗ) «Технополис Москва» около восьми тысяч квадратных метров помещений. «Особая экономическая зона — это привлекательная площадка для размещения высокотехнологичных производств. В 2022 году арендаторами помещений инновационных лабораторно-промышленных корпусов на площадке “Алабушево” стали еще восемь компаний. Предприятия будут разрабатывать и производить микроэлектронику и электронное оборудование, видеорегистраторы и видеокамеры, медицинские изделия и тест-системы. Они заняли почти восемь тысяч квадратных метров. Благодаря им в городе появилось более 370 новых рабочих мест», — сообщил заместитель Мэра Москвы по вопросам экономической политики и имущественно-земельных отношений Владимир Ефимов. Еще 10 высокотехнологичных предприятий в этом году стали резидентами особой экономической зоны столицы. Четыре из них уже работают, производства шести будут введены в эксплуатацию в ближайшие месяцы. Большинство из этих компаний представляют отрасль медицинских технологий, оборудования и биофармы. Они будут выпускать препараты для таргетной терапии онкологических заболеваний, синтетические сосуды, заменители суставной жидкости, современное ультразвуковое диагностическое оборудование. «В этом году резидентами особой экономической зоны Москвы стали три предприятия, которые относятся к высокотехнологичным производствам. Они специализируются на выпуске электрогрузовиков, упаковки для лекарств и пластиковых палет. Еще три работают в сфере микроэлектроники и ИТ. В общей сложности предприятия, получившие статус резидента в этом году, заняли помещения площадью свыше 30 тысяч квадратных метров. Из них около 20 тысяч построено самими компаниями», — подчеркнул руководитель Департамента инвестиционной и промышленной политики Владислав Овчинский. Резиденты ОЭЗ «Технополис Москва» освобождаются от уплаты земельного, имущественного и транспортного налогов на 10 лет, а ставка налога на прибыль для них снижена до двух процентов. Ввозимые ими товары и оборудование не облагаются таможенными сборами. Удобные локации, развитая транспортная инфраструктура, современные коммуникации и комфортные условия для сотрудников — вот неполный перечень того, что получают арендаторы, размещая свое производство на любой из пяти площадок особой экономической зоны «Технополис Москва». Среди преимуществ, которые получают резиденты, — поддержка Правительства Москвы, возможность промышленной кооперации с соседними производствами, регулярное участие в различных деловых мероприятиях и профессиональных объединениях, отметил генеральный директор ОЭЗ «Технополис Москва» Геннадий Дегтев. ОЭЗ «Технополис Москва» — территория с особым юридическим статусом, на которой действует льготный режим предпринимательской деятельности для инвесторов. Площадь пяти площадок («Печатники», «Алабушево», «Микрон», «МИЭТ», «Ангстрем»), на которых размещаются высокотехнологичные предприятия, превышает 223 гектара. Объем инвестиций компаний, локализовавших производство на территории ОЭЗ столицы, превышает 85 миллиардов рублей. «Технополис Москва» на протяжении нескольких лет является лидером международных и национальных отраслевых рейтингов. Больше информации об экономической политике и имущественно-земельных отношениях Москвы — на сайте economy.mos.ru.;Владимир Ефимов, технополис Москва, аренда помещений, Владислав Овчинский, резиденты ОЭЗ
Москва стала лауреатом премии Investment Leaders Award за лучшее инвестиционное решение года;Московский Департамент инвестиционной и промышленной политики стал лауреатом премии Investment Leaders Award в номинации «Инвестиционное решение». Его работу признали лучшей за разработку комплексного решения для локализации важных для города производств, сообщил глава ведомства Владислав Овчинский. Премию Investment Leaders Award вручают ежегодно наиболее успешным участникам рынка инвестиций. Победителей выбирает жюри, куда входят представители Торгово-промышленной палаты Российской Федерации, Ассоциации российских банков, Национальной финансовой ассоциации и других экспертных сообществ. «Москва разработала комплексное решение для привлечения инвесторов, которое поможет закрыть потребности города в критически важных продуктах или услугах: лекарственных препаратах, медизделиях, детском питании. Речь о локализации производств на территории особой экономической зоны (ОЭЗ) “Технополис Москва” в рамках реализации офсетных контрактов. Инвестор получает не только гарантию сбыта продукции, но и значительные налоговые льготы как резидент ОЭЗ. Таким комплексным решением воспользовались три компании, две из них уже возвели заводы по производству лекарств и медизделий и поставляют продукцию для нужд столицы», — рассказал Владислав Овчинский. Третья компания сейчас строит фармацевтическое предприятие на площадке ОЭЗ в Алабушеве. Завершить работы планируют в следующем году. Москва активно использует офсетные контракты: сейчас их заключено пять, на очереди еще несколько. По условиям офсета инвестор должен либо создать новое производство, либо модернизировать существующее. Взамен город гарантирует, что будет закупать продукцию в течение нескольких лет. Москва фактически реализует нужный ей проект за деньги инвестора и получает постоянного поставщика товаров по сниженной цене. У бизнеса же появляется надежный партнер, который гарантированно купит его продукцию. В контракте заранее прописаны точные объемы и сроки, в течение которых город будет это делать. Так обеспечиваются бесперебойность работы организации в любой ситуации и индексация цены контракта. Комплексное решение предполагает локализацию предприятий в особой экономической зоне «Технополис Москва». Резидентам предоставляют налоговые и таможенные преференции. На 10 лет их освобождают от уплаты земельного, имущественного и транспортного налогов. Ставка налога на прибыль снижается до двух процентов. При этом инвестор получает площадку со всеми необходимыми техническими условиями и возможностями для запуска производства. ОЭЗ «Технополис Москва» — территория с особым юридическим статусом, на которой действует льготный режим предпринимательской деятельности для инвесторов. Площадь пяти площадок («Печатники», «Алабушево», «Микрон», «МИЭТ», «Ангстрем»), на которых размещаются высокотехнологичные предприятия, превышает 223 гектара. Общая площадь производственных корпусов составляет 550 тысяч квадратных метров. Объем инвестиций компаний, локализовавших производство на территории особой экономической зоны столицы, превышает 80 миллиардов рублей. ОЭЗ «Технополис Москва» на протяжении нескольких лет становится лидером международных и национальных отраслевых рейтингов.;премии, инвесторы, технополис Москва, Владислав Овчинский, офсетные контракты, локализация производства
Снег с московских улиц убирают 60 тысяч сотрудников коммунальных служб и 10 тысяч единиц техники;Около 60 тысяч рабочих и 10 тысяч единиц техники задействовали в уборке снега в столице, сообщил заместитель Мэра Москвы по вопросам жилищно-коммунального хозяйства и благоустройства Петр Бирюков. «За минувшие сутки в городе выпало четыре сантиметра снега, сегодня ожидается прирост еще на один сантиметр, — отметил он. — Все городские службы работают в режиме повышенной готовности, на круглосуточном дежурстве находятся аварийные бригады инженерных компаний и префектур округов». По словам заммэра, коммунальная техника раз в несколько часов проводит сплошное механизированное подметание проезжей части, тротуаров и дворов с противогололедной обработкой. «Особое внимание уделяется очистке пешеходных зон, тротуаров, подходов к остановкам общественного транспорта, станциям метро и Московского центрального кольца, железнодорожным станциям и платформам, ТПУ, объектам социальной сферы и потребительского рынка, — рассказал Петр Бирюков. — Для помощи водителям грузовых автомобилей, в первую очередь на МКАД и на дорогах в ТиНАО, организовано дежурство тягачей». Водителей из-за ухудшения погоды он призвал быть аккуратнее на дороге, строго соблюдать скоростной режим и дистанцию.;снегопад, коммунальные службы, уборка снега, Петр Бирюков
Утвержден проект планировки нового жилого квартала по программе реновации в Зюзине;Правительство Москвы утвердило проект планировки территории площадью 6,76 гектара в районе Зюзино. Соответствующее постановление подписал Сергей Собянин. Речь идет об участках, расположенных по адресу: Одесская улица, владения 4–6. Территория, которую ожидает комплексная застройка по программе реновации, находится недалеко от станции метро «Нахимовский проспект». Сейчас здесь в основном располагаются автосервисы. Проект планировки предусматривает строительство современного жилого квартала для переселения по программе реновации. Общая площадь застройки составит 144 тысячи квадратных метров, включая жилье (139,4 тысячи квадратных метров) и детский сад на 200 мест. Чтобы обеспечить будущий квартал инженерно-коммунальной инфраструктурой, проложат сети коммуникаций, построят распределительно-трансформаторный пункт и трансформаторные подстанции. Реализация проекта позволит создать комфортные условия для проживания свыше трех тысяч человек. Проект планировки подготовили на основании постановления Правительства Москвы от 5 октября 2021 года № 1552-ПП.  Подробнее о программе реновации;Сергей Собянин, жилье, программа реновации, Зюзино, жилые кварталы
Возле Курского вокзала открылась выставка граффити «Со-единение»;В арт-квартале возле Курского вокзала открылась выставка уличного искусства «Со-единение». Проект реализует Москомархитектура и центр современного искусства (ЦСИ) «Винзавод». «У нас сложилась хорошая, добрая творческая традиция. В этом году Москомархитектура эту традицию продолжила. В результате у нас появилось пространство, где соединились городская жизнь и проекты стрит-арт-художников», — сказала Юлиана Княжевская, председатель столичного Комитета по архитектуре и градостроительству. Граффити размещены на территории уникального креативного пространства Москвы — арт-квартала. Мимо стены, расположенной вдоль железнодорожных путей, по дороге от Курского вокзала в сторону двух креативных кластеров — ЦСИ «Винзавод» и центра дизайна Artplay ежедневно проходят тысячи человек.          Концепцию экспозиции разработали специалисты Москомархитектуры и центра современного искусства «Винзавод» в направлении Urban + Art. Проект направлен на поддержку уличных художников. Был проведен закрытый конкурс, участие в котором приняли 12 человек. Экспертная комиссия оценивала портфолио, концепции работ на соответствие теме и сочетаемость друг с другом. В результате было выбрано шесть художников, среди которых Рома Мураткин, Миша Most, Алексей Luka, Оля Iney, Саша Blot и Вова Nootk. В их произведениях отразились размышления на тему городской среды и ее взаимодействия с современным искусством. «Мы выбирали яркие творческие высказывания, которые привлекут внимание, тронут зрителя, призовут его к диалогу. Ведь именно такова задача искусства. Не случайно выставка называется “Со-единение”: это пространство — место диалога города со своими жителями. Москва, как город максимально разноплановый, просто создана для таких проектов», — отметил главный архитектор Москвы, первый заместитель председателя столичного Комитета по архитектуре и градостроительству Сергей Кузнецов. Выставка «Со-единение» продлится до мая 2023 года, после чего экспозиция обновится.;выставки, экспозиции, Сергей Кузнецов, современное искусство, Юлиана Княжевская
Около пяти тысяч машино-мест появилось в ТиНАО с начала 2022 года;На территории Троицкого и Новомосковского административных округов с начала 2022 года оборудовали 4840 машино-мест. Об этом сообщил руководитель Департамента развития новых территорий города Москвы Владимир Жидкин.  За этот период в ТиНАО появилось 14 гаражных объектов. Благодаря этому 3791 машино-место организовано в подземных паркингах, еще 388 машин автовладельцы разместили на обустроенных плоскостных парковках. «Вопрос обеспечения формирующихся городских кварталов в ТиНАО парковочными местами актуальный, как и в целом по столице. Поэтому в новых проектах закладывается необходимость строительства паркингов, подземных парковок или гаражей. Они возводятся за счет инвесторов. Создание дополнительных машино-мест является частью общей работы по формированию качественной и комфортной городской среды», — рассказал Владимир Жидкин. Один из самых крупных — многоэтажный паркинг в составе жилого комплекса в деревне Язово. Его площадь составляет более 35,5 тысячи квадратных метров, он рассчитан на 1210 машин. В поселении Московский построен гаражный комплекс площадью свыше 34 тысяч квадратных метров на 1075 машин. Недавно Мосгосстройнадзор выдал разрешение на ввод в эксплуатацию новостройки, расположенной по адресу: поселение Внуковское, бульвар Андрея Тарковского, дом 14. Общая площадь здания с переменной этажностью составляет 44 тысяч квадратных метров, в нем 811 квартир. Подземная автостоянка вмещает 310 автомобилей. Кроме того, введена в эксплуатацию наземная автостоянка в жилом комплексе «Саларьево парк» вблизи деревни Николо-Хованское. Здесь построили шестиуровневую парковку общей площадью более 11 тысяч квадратных метров. На стоянке оборудовано 406 машино-мест, в том числе 16 для автомобилей с увеличенными габаритами. Владимир Жидкин добавил, что ежегодно в ТиНАО создается от пяти до шести тысяч новых машино-мест. Этот объем сохранится и в этом, и в следующем году.;паркинги, машино-места, Владимир Жидкин, жилые дома, автостоянки
